{
  "inode": 1180621,
  "exists": true,
  "source_hash": "9f2b1c0a4e7d8b30",
  "derivatives": [
    { "kind": "tech",      "status": "ready", "producer": "linux-farm", "version": 1, "hash": "9f2b1c0a4e7d8b30", "blob_rel_path": null,            "media_type": null,             "model": null, "dim": null, "updated_at": 1750000000 },
    { "kind": "proxy",     "status": "ready", "producer": "linux-farm", "version": 1, "hash": "9f2b1c0a4e7d8b30", "blob_rel_path": "proxy.mp4",     "media_type": "video/mp4",       "model": null, "dim": null, "updated_at": 1750000000,
      "codec": "h264", "codec_string": "avc1.640028, mp4a.40.2", "blob_size": 20447232 }
  ]
}
