{
  "inode": 1180417,
  "exists": true,
  "source_hash": "9f2b1c0a4e7d8b30",
  "derivatives": [
    { "kind": "tech",      "status": "ready",   "producer": "linux-farm", "version": 1, "hash": "9f2b1c0a4e7d8b30", "blob_rel_path": null,            "media_type": null,             "model": null,                  "dim": null, "updated_at": 1750000000 },
    { "kind": "thumbnail", "status": "ready",   "producer": "linux-farm", "version": 1, "hash": "9f2b1c0a4e7d8b30", "blob_rel_path": "poster.jpg",    "media_type": "image/jpeg",      "model": null,                  "dim": null, "updated_at": 1750000000 },
    { "kind": "filmstrip", "status": "ready",   "producer": "linux-farm", "version": 1, "hash": "9f2b1c0a4e7d8b30", "blob_rel_path": "strip.jpg",     "media_type": "image/jpeg",      "model": null,                  "dim": null, "updated_at": 1750000000,
      "filmstrip": { "frame_count": 120, "cols": 12, "rows": 10, "cell_w": 160, "cell_h": 90, "interval_ms": 1000, "duration_ms": 120000 } },
    { "kind": "waveform",  "status": "ready",   "producer": "linux-farm", "version": 1, "hash": "9f2b1c0a4e7d8b30", "blob_rel_path": "waveform.json", "media_type": "application/json", "model": null,                  "dim": null, "updated_at": 1750000000 },
    { "kind": "proxy",     "status": "pending", "producer": "linux-farm", "version": 1, "hash": null,               "blob_rel_path": null,            "media_type": "video/mp4",       "model": null,                  "dim": null, "updated_at": 1750000000 },
    { "kind": "embedding", "status": "ready",   "producer": "linux-farm", "version": 1, "hash": "9f2b1c0a4e7d8b30", "blob_rel_path": null,            "media_type": null,             "model": "openclip-vit-b32-v1", "dim": 512,  "updated_at": 1750000000 },
    { "kind": "ai",        "status": "ready",   "producer": "linux-farm", "version": 1, "hash": "9f2b1c0a4e7d8b30", "blob_rel_path": "ai.loupe.json", "media_type": "application/json", "model": "openclip-vit-b32-v1", "dim": 512,  "updated_at": 1750000000 }
  ]
}
